{
  "phase": "3.5",
  "verdict": "PASS",
  "timestamp": "2026-06-19T01:05:22.228721+00:00",
  "mode_threshold": 99,
  "iterations": 2,
  "judge_verdicts": [
    {
      "section": "A",
      "retrieve_agent_id": "retrieve-A-iter1",
      "judge_agent_id": "judge-A-iter1",
      "brief_hash": "3b9e70789b9aa808f0615f554a82f0734ba25837c4922d8bac551b1470a18764",
      "score": 98,
      "verdict": "PASS",
      "iteration": 1
    },
    {
      "section": "B",
      "retrieve_agent_id": "retrieve-B-iter2",
      "judge_agent_id": "judge-B-iter2",
      "brief_hash": "4bbbf6613e6b92a77203a037de79b1a79b51c11666ce9e3ffb9809922ca8cb47",
      "score": 97,
      "verdict": "PASS",
      "iteration": 2
    }
  ],
  "halt_reasons": [],
  "attestation_chain": {
    "iter_start_ts": "2026-06-19T01:03:17.120345+00:00",
    "attest_ts": "2026-06-19T01:05:22.228723+00:00",
    "iteration": 2,
    "judge_sources": [
      {
        "section": "A",
        "iteration": 1,
        "sha256": "a7a9cd5a714f603a1ed3304a824b1d2b930cc73edb4208cb94954451d7c34ee4",
        "path": "judges/judge-A.json",
        "mtime": "2026-06-19T00:52:28.061345+00:00"
      },
      {
        "section": "B",
        "iteration": 2,
        "sha256": "0bc31c9f7a68f23aac3e8ab984f6cf5d938212342b2949af1dd73fed3f91f780",
        "path": "judges/judge-B.json",
        "mtime": "2026-06-19T01:04:42.875073+00:00"
      }
    ]
  }
}